<?xml version="1.0" encoding="ISO-8859-1" ?>
<mvp4g xmlns:xsi="http://www.w3.org/2001/XMLSchema-instance" xsi:noNamespaceSchemaLocation="http://mvp4g.googlecode.com/svn/tags/mvp4g-1.0.0/xsd/mvp4g-conf.xsd">

	<debug enabled="true" />

	<childModules package="com.mvp4g.example.client" beforeEvent="beforeLoad" afterEvent="afterLoad" errorEvent="errorOnLoad">
		<childModule name="companyModule" class=".company.CompanyModule" eventToLoadView="changeBody"/>
		<childModule name="productModule" class=".product.ProductModule" eventToLoadView="changeBody" async="false" autoLoad="false"/>	
	</childModules>
	<history package="com.mvp4g.example.client.main.historyConverter" initEvent="start">
		<converter name="noParamHC" class="NoParamHistoryConverter"/>
	</history>
	<views package="com.mvp4g.example.client.main" >
		<view name="rootView" class="MainView" />		
	</views>	
	<presenters package="com.mvp4g.example.client.main" >
		<presenter name="rootPresenter" class="MainPresenter" view="rootView" />		
	</presenters>
	<events>
		<event type="goToCompany" handlers="" modulesToLoad="companyModule" history="noParamHC"/>
		<event type="goToProduct" handlers="" modulesToLoad="productModule" history="noParamHC" />
		<event type="changeBody" handlers="rootPresenter" />
		<event type="errorOnLoad" handlers="rootPresenter" />
		<event type="beforeLoad" handlers="rootPresenter"/>
		<event type="afterLoad" handlers="rootPresenter"/>
		<event type="displayMessage" handlers="rootPresenter"/>
		<event type="start" handlers="" />		
		<event type="selectCompanyMenu" handlers="rootPresenter"/>
		<event type="selectProductMenu" handlers="rootPresenter"/>		
	</events>
	
	<start view="rootView" history="true"/>
	
</mvp4g>		